question,answer
how often should one focus on tracking fitness progress for optimal results,engaging in tracking fitness progress helps build endurance improve cardiovascular health and strengthen specific muscle groups consistency is key to reaping its full benefits along with proper technique
what should beginners know about physical activities,physical activities is an excellent way to stay active and maintain a healthy lifestyle beginners should start slow and gradually increase intensity for the best results
what advanced variations exist for rest day optimization,advanced variations of rest day optimization might include added weights instability challenges or combining it with complementary movements
what variations of high knees can i try for advanced training,advanced variations of high knees include weighted versions singlearm or singleleg modifications or combining them with other movements for a fullbody challenge
how can i modify glute bridges for beginners,beginners can modify glute bridges by reducing the range of motion using assistance like resistance bands or performing it at a slower pace to build strength gradually
what are common mistakes to avoid in weight management,avoid overtraining or improper techniques while practicing weight management staying consistent and focusing on form is key to avoiding injuries
what role does proper planning play in achieving nutrition basics goals,planning in nutrition basics helps maintain motivation track improvements and overcome obstacles structured routines are key
what is the correct form for preworkout meals,the correct form for preworkout meals includes maintaining a neutral spine engaging your core and controlled movement
how does postworkout stretching differ from other similar techniques,postworkout stretching is unique due to its focus on specific feature making it ideal for certain fitness goals
what kind of cardio workouts are recommended for ectomorphs,ectomorphs should engage in lowintensity cardio for  minutes twice a week to support heart health and performance
tell be about singleleg kettlebell deadlift,the kettlebell singleleg deadlift is a variation on the kettlebell deadlift where one foot stays planted on the ground while the other raises into the air at the bottom of the movement its popular in lowerbody training for strength and muscle building but also trains balance grip and the core muscles
can endurance programming improve my overall fitness if yes how,yes endurance programming enhances overall fitness by improving strength flexibility or cardiovascular health depending on execution
how can improper ab rollouts form lead to injuries,incorrect form during ab rollouts can strain muscles and joints increasing the risk of injuries proper alignment and technique are crucial
how can i promote healthy digestion and gut health through dietary choices and lifestyle habits,increase dietary fiber  consuming a diet high in fiber can help promote digestive health by preventing constipation and promoting regular bowel movements whole grains legumes vegetables fruits nuts and seeds are all excellent sources of dietary fiber  eat probiotic foods  probiotics are live microorganisms that can improve gut health by helping stabilize the bacterial balance in the gut eating foods like yogurt kefir miso sauerkraut and kombucha can help increase your probiotic intake  reduce stress  stress has been linked to a number of
how do i prevent overtraining and burnout,listen to your body incorporate rest days prioritize sleep and include active recovery in your routine vary your workouts to prevent monotony and dont hesitate to take breaks when needed
tell be about barbell reverse lunge,the barbell reverse lunge is a popular lowerbody exercise targeting the quads glutes and hamstrings using a barbell allows you to overload the exercise beyond body weight and perform the movement in strength or musclefocused rep ranges the reverse lunge can be performed as part of a barbell complex in a circuit or on its own in the lowerbody portion of any workout
tell be about jump squat,the jump squat is an explosive bodyweight exercise targeting the quads hamstrings and glutes it is also a serious cardiovascular challenge when done for reps it can be performed as a power exercise to build jumping power or in any fatloss or athleticismfocused workout
what are some easy ways to add more movement to a sedentary day,set hourly reminders to stand or stretch take short walks and use stairs instead of elevators desk exercises can also be effective
how can i prioritize selfcare and establish boundaries to prevent burnout in my personal and professional life,make sure that you give yourself sufficient time for yourself for rest and relaxation schedule breaks and time to do something that you enjoy like taking a walk doing yoga going to the park or watching a movie  identify activities that will reduce stress and help you relax take some time each day to gravitate towards activities that will help you relax and destress such as reading listening to music or engaging in a hobby  prioritize sleep make sure that you are getting adequate sleep and if needed allow yourself an extra hour or two of sleep if needed
tell be about parallel bar dip,the triceps dip is a bodyweight exercise performed on parallel bars or on a pullup and dip station it targets the triceps first but also stretches and strengthens the chest and shoulders dips with a triceps focus are usually performed with an upright torso the knees bent and crossed and the arms close to the body dips can be performed for low reps for strength or higher reps for muscle growth
tell be about leverage chest press,the machine chest press is an upper body exercise targeting the pectoral muscles
what are some indicators that individuals may need to adjust their fat loss strategies or seek professional guidance,persistent weight plateaus extreme fatigue mood changes hormonal irregularities or signs of disordered eating behaviors may indicate the need for adjustments to fat loss strategies or consultation with a healthcare professional
can training plateaus improve my overall fitness if yes how,yes training plateaus enhances overall fitness by improving strength flexibility or cardiovascular health depending on execution
can lunges be adapted for home workouts,yes lunges can be adapted for home workouts using minimal equipment or body weight ensuring accessibility for all fitness levels
how can i optimize my performance in endurance programming,to optimize performance in endurance programming focus on technique consistency and gradually increasing resistance or intensity
tell be about reverse grip triceps pushdown,the reversegrip cable straightbar pushdown is a twist on the popular cable straightbar pushdown the difference has to do with how the hands are positioned holding the bar the palms facing up rather than down because grip will be a limiting factor this movement is usually performed for moderate to high reps such as  reps per set or higher
im new to the gym and feeling overwhelmed where should i start,dont worry starting at the gym can be intimidating but its all about taking small steps begin with a simple fullbody workout routine that includes exercises like squats pushups and lunges consistency is key
what is the best way to progress with deadlifts,to progress in deadlifts gradually increase intensity by adding weight repetitions or resistance tracking performance helps sustain improvements
what are the top exercises for improving nutrition for muscle growth,engaging in nutrition for muscle growth helps build endurance improve cardiovascular health and strengthen specific muscle groups consistency is key to reaping its full benefits along with proper technique
are there any common mistakes to avoid while doing kettlebell swings,common mistakes in kettlebell swings include improper alignment rushing through repetitions and failing to engage core muscles focus on technique to prevent injuries
tell be about standing behindtheback wrist curl,the standing behindtheback wrist curl is a popular exercise to target the muscles in the forearms wrists and fingers it is generally performed for moderate to high reps such as  reps per set and can work as isolated forearm training or as part of an armsfocused workout
how does foam rolling methods help prevent injuries,foam rolling methods minimizes the risk of injury by strengthening supportive muscles and improving joint mobility
is it possible to build muscle while losing weight,yes its possible but challenging focus on a slight calorie deficit prioritize protein intake and incorporate strength training accept that muscle gains may be slower during weight loss phases
what are some common mistakes in plyometric training,common mistakes in plyometric training include neglecting alignment overloading weights and rushing through reps
whats the best way to stay motivated on days i dont feel like working out,we all have those days set achievable goals find a workout buddy or join classes for accountability remember how great you feel after a workout take it step by step and be kind to yourself
tell be about singleleg glute bridge,the singleleg glute bridge is a lowerbody exercise that targets the glutes lower back and hamstrings it is performed one side at a time
are there any common mistakes to avoid while doing stepups,common mistakes in stepups include improper alignment rushing through repetitions and failing to engage core muscles focus on technique to prevent injuries
tell be about dumbbell bicep curl,the dumbbell biceps curl is a singlejoint exercise for building bigger and stronger biceps popular among gym goers of all experience levels this move can be done seated or standing it is generally performed for moderate to high reps such as  reps or higher as part of the armfocused portion of a workout
tell be about medicine ball rotational throw,the medicine ball rotational throw is an explosive exercise targeting the abdominals including the obliques as well as the hips and upper back it involves standing sideways to the wall and twisting the torso to hurl a medicine ball into the wall then catching the ball on the ricochet it can be performed for lower reps with a focus on power or for higher reps with a focus on fat loss and conditioning
are there any common mistakes to avoid while doing spider crawls,common mistakes in spider crawls include improper alignment rushing through repetitions and failing to engage core muscles focus on technique to prevent injuries
how often should i include progressive overload in my routine,include progressive overload in your routine 23 times per week ensuring adequate recovery time between sessions
how does unstable surface training differ from other similar techniques,unstable surface training is unique due to its focus on specific feature making it ideal for certain fitness goals
what is the science behind the benefits of recovery techniques,to maximize benefits from recovery techniques focus on maintaining proper posture staying hydrated and warming up beforehand this minimizes risks and ensures longterm progress
what variations of calf raises can i try for advanced training,advanced variations of calf raises include weighted versions singlearm or singleleg modifications or combining them with other movements for a fullbody challenge
what should i focus on when starting sprinting mechanics,when starting sprinting mechanics prioritize learning the basics and seek guidance if needed
what are the best techniques for performing sportsspecific recovery,the best techniques for sportsspecific recovery involve maintaining proper alignment controlled movement and engaging the targeted muscles effectively
what are common mistakes to avoid in sportsspecific recovery,common mistakes in sportsspecific recovery include poor form overloading and neglecting warmups focus on technique before increasing intensity
what variations of farmers walk can i try for advanced training,advanced variations of farmers walk include weighted versions singlearm or singleleg modifications or combining them with other movements for a fullbody challenge
can endurance programming help with injury prevention,yes endurance programming can prevent injuries by improving muscle imbalances and joint stability
tell be about machine shoulder military press,the machine shoulder press is an upper body exercise targeting the deltoids
how does foam rolling benefits differ for beginners and advanced athletes,for beginners foam rolling benefits should be simplified with lower resistance advanced athletes can explore variations and added weight
tell be about barbell hip thrust,the barbell hip thrust is an exercise that engages the posterior chain particular the glutes it involves fully extending your hips while holding a weighted barbell across the midsection
tell be about bodyweight walking lunge,the walking lunge is a lowerbody exercise that targets the glutes quads and hamstrings while challenging stability and balance it can be performed for reps time or distance in the lowerbody portion of any workout
tell be about closegrip barbell curl,the closegrip barbell curl is a curl variation where the hands are closer than shoulder width it is thought that this helps build the outer biceps head and the peak this curl variation is usually performed for moderate to high reps such as  reps per set
tell be about ezbar skullcrusher,the ezbar skullcrusher is a popular exercise targeting the triceps muscles the ezbar is used more often than a straight bar as for the name thats worstcase scenario the bar should actually come down behind the head it is usually performed for moderate to high reps as part of an upper body or armsfocused workout no need to chase a rm on this move
how does age affect mobility exercises and what adaptations are needed,as we age mobility exercises should adapt by reducing intensity increasing recovery periods and emphasizing mobility to maintain performance and safety
how often should i include training plateaus in my routine,include training plateaus in your routine 23 times per week ensuring adequate recovery time between sessions
how does recovery time vary depending on the intensity of warmup routines,the intensity of warmup routines dictates recovery needs higher intensities require more time for muscle repair and glycogen replenishment
tell be about smith machine lunge sprint,the smith machine lunge sprint is a lowerbody power exercise performed with the bar of a smith machine on the back it is similar to an alternating jump lunge or scissor lunge but with added weight the contained bar of the smith machine makes it safer and less of a balance challenge than using a free weight
why is periodization techniques important for overall fitness,periodization techniques is crucial for overall fitness because it addresses key areas like endurance strength or recovery
what are some common mistakes in training plateaus,common mistakes in training plateaus include neglecting alignment overloading weights and rushing through reps
tell be about reverse machine flyes,the machine rear delt fly is an exercise targeting the rear head of the shoulder muscle or deltoids as well as the muscles of the upper back its sort of the reverse of the machine chest fly and is sometimes performed on the same machine but facing the opposite direction because it targets such small muscles this exercise is usually performed with light weight for high reps such as  reps per set or more
how does age affect sportsspecific conditioning and what adaptations are needed,as we age sportsspecific conditioning should adapt by reducing intensity increasing recovery periods and emphasizing mobility to maintain performance and safety
what should i focus on when starting swimming crosstraining benefits,when starting swimming crosstraining benefits prioritize learning the basics and seek guidance if needed
what are some effective ways to improve and maintain cardiovascular fitness,keep a regular exercise routine everyone should aim for at least  minutes of physical activity a day for improved heart health vary your routine with different types of exercise for a fullbody cardiovascular workout  add strength training to your routine build and strengthen your heart muscle with strength training this will also help to improve your overall fitness  eat a balanced diet eating a balanced diet is an essential part of a hearthealthy lifestyle focus on eating a variety of vegetables fruits whole grains lean proteins and healthy fats  monitor your heart rate
how should i warm up before performing postworkout protein intake,a warmup before postworkout protein intake should include dynamic stretches and lighter sets to prepare the muscles involved
are there exceptions to the typical characteristics of each body type,yes individuals may exhibit traits from multiple body types making it important to consider a range of factors when planning fitness routines
how can i incorporate regular relaxation and selfcare practices into my daily routine to promote overall wellbeing,start your day with a minute mindful meditation before beginning your daily tasks take a few minutes to relax and get in tune with your breath  take breaks throughout the day every hour or two stand up stretch and take a few minutes away from your work to relax and refocus  practice deep breathing place your hand on your abdomen and take slow deep breaths for a few minutes  go for a walk during lunch after youve eaten take a walk around the block or in a park to get some fresh air
how should endomorphs approach their strength training routine,endomorphs should focus on heavy to moderate strength training with a mix of compound and isolation exercises incorporating drop sets and supersets
what are the benefits of machine exercises for fitness goals,machine exercises offers several benefits including better strength flexibility and injury prevention
tell be about kettlebell alternating floor press,the kettlebell alternating floor press limits the range of motion you would achieve with a dumbbell or kettlebell bench press but still targets the chest triceps and anterior delts this allows you to build strength in the top portion of the lift overload the triceps and work on strengthening the shoulder stabilizers
how can beginners safely start with plyometric drills,beginners should start with bodyweight or light resistance for plyometric drills focusing on mastering form before intensity
tell be about romanian deadlift,the barbell stifflegged deadlift targets the hamstrings glutes lower and upper back as well as the core it is a popular accessory movement for the deadlift but also a musclebuilding hamstring movement
how does home fitness impact overall health,incorporating home fitness into your routine promotes cardiovascular health improves stamina and enhances muscle tone proper planning ensures maximum benefits
are there common mistakes in training plateaus i should avoid,common mistakes in training plateaus include rushing through movements and neglecting proper alignment
what should i focus on when starting foam rolling benefits,when starting foam rolling benefits prioritize learning the basics and seek guidance if needed
what is the science behind the benefits of hydration and performance,to maximize benefits from hydration and performance focus on maintaining proper posture staying hydrated and warming up beforehand this minimizes risks and ensures longterm progress
how often should i include balancing fitness with work life in my routine,include balancing fitness with work life in your routine 23 times per week ensuring adequate recovery time between sessions
what are some effective ways to practice selfcare and nurture my mental and emotional health,get adequate exercise regular exercise can be a great way to boost your mental and emotional health even light physical activities like walking swimming or biking can be great starting points  eat healthily eating healthy and nutritious meals can have a positive impact on your mental and emotional health it can also help reduce stress anxiety and depression  get enough sleep getting an adequate amount of quality sleep is essential for mental and emotional wellbeing aim for  hours of restful sleep every night  disconnect from technology taking breaks from technology and social media can
tell be about lying bench reverse crunch,the lying bench reverse crunch is a popular ab exercise performed by bringing the knees toward the chest while lying on a bench it is largely similar to the same exercise performed on the floor but being able to press the lower back into the bench pad can help reinforce proper form and increase the burn in the abs like most crunch variations it is usually performed for moderate to high reps such as  reps per set or more
what are the best tools or technologies for enhancing plyometric exercises,tools like wearable trackers apps and specialized equipment can enhance plyometric exercises making it more measurable and efficient
what are some effective methods for portion control and mindful eating to prevent overeating,eat slowly take your time and chew your food properly this gives your body time to signal you when youre full  start with a smaller portion take a small amount of food that you think you will be satisfied with then choose to have more if you are still hungry  distract yourself avoid eating while watching television or using your phone as this can lead to mindless eating  pour your snacks into a bowl measure out a single portion of snacks and then pour it into a bowl instead of eating out of a package it
are there common mistakes in barbell deadlift technique i should avoid,common mistakes in barbell deadlift technique include rushing through movements and neglecting proper alignment
what advanced tips do you have for injury prevention for runners,advanced tips for injury prevention for runners include incorporating progressive overload and experimenting with variations
how can i establish healthy boundaries in my personal and professional relationships to maintain overall wellbeing,get to know and understand yourself take time to reflect know what your values boundaries and needs are and how to express them identify what is important to you and understand why  communicate clearly let people know your boundaries do so in a direct and respectful manner let them know what you will and wont accept  respect others boundaries respect other peoples boundaries and be willing to compromise when necessary  dont become too involved dont become too emotionally involved in
what equipment is needed to practice outdoor running effectively,outdoor running not only improves physical fitness but also reduces stress and enhances mental clarity combining it with a balanced diet can amplify the results
how can group fitness classes be modified for people with busy schedules,to maximize benefits from group fitness classes focus on maintaining proper posture staying hydrated and warming up beforehand this minimizes risks and ensures longterm progress
tell be about barbell shoulder press,the seated barbell shoulder pressis a classic exercise for building muscle and strengthening the shoulders particularly but not exclusively the front heads the triceps also play a significant roles in pressing the barbell overhead
are there any common mistakes to avoid while doing mountain climbers,common mistakes in mountain climbers include improper alignment rushing through repetitions and failing to engage core muscles focus on technique to prevent injuries
which groups of people benefit most from hydration tips for athletes,hydration tips for athletes benefits beginners and advanced athletes looking to enhance performance in specific areas
tell be about captains chair knee raise,the captains chair knee raise is a bodyweight exercise that targets the abs it is performed on an apparatus that allows the forearms to rest on pads and the upright torso to hang freely knee raises are often performed for moderate to high reps such as  reps or more as part of abfocused training
tell be about standing dumbbell reverse curl,with the reversegrip dumbbell curl the palms face down not up this unorthodox wrist position simultaneously targets the biceps while also building forearm and grip strength the move can performed standing or seated
why is sports performance important for maintaining overall wellness,sports performance plays a critical role in preventing illnesses enhancing performance and supporting a balanced lifestyle
what advanced tips do you have for recovery for runners,advanced tips for recovery for runners include incorporating progressive overload and experimenting with variations
tell be about smith machine shrug,the smith machine shrug is an upperbody exercise targeting the traps trapezius muscles it is usually performed for moderate to high reps such as  reps per set or more as part of shoulder or trapfocused training
what are some beginner tips for improving technique improvement,improving technique improvement involves consistent effort learning proper techniques and tailoring routines to your individual needs
what are some beginner tips for improving training programs,improving training programs involves consistent effort learning proper techniques and tailoring routines to your individual needs
what is the correct form for mobility for olympic lifts,the correct form for mobility for olympic lifts includes maintaining a neutral spine engaging your core and controlled movement
