question,answer
how can i establish healthy digital habits and manage screen time to support my overall wellbeing,establish time limits and have set times when you are not using digital devices for example no screens after  pm  take regular breaks throughout the day from your digital devices for example set a timer every hour or two to remind you to step away from your devices for a few minutes  find an alternate activity to engage in when you need a break from digital screens for example go for a walk read a book or take a yoga class  be mindful of how you are using digital devices for example recognize when scrolling through social
can you explain the progression strategies for mastering resistance band exercises,progression strategies for resistance band exercises include adding resistance increasing repetitions or trying advanced variations
what should i focus on when starting advanced hiit protocols,when starting advanced hiit protocols prioritize learning the basics and seek guidance if needed
can balancing fitness with work life improve my overall fitness if yes how,yes balancing fitness with work life enhances overall fitness by improving strength flexibility or cardiovascular health depending on execution
how do i properly perform jumping jacks,to perform jumping jacks correctly focus on maintaining proper form start slowly keep your movements controlled and engage the appropriate muscle groups
can skipping rope be adapted for home workouts,yes skipping rope can be adapted for home workouts using minimal equipment or body weight ensuring accessibility for all fitness levels
how can i modify leg raises for beginners,beginners can modify leg raises by reducing the range of motion using assistance like resistance bands or performing it at a slower pace to build strength gradually
can hypertrophyspecific training help with injury prevention,yes hypertrophyspecific training can prevent injuries by improving muscle imbalances and joint stability
what is the scientific basis behind effective cardio endurance,effective cardio endurance is underpinned by principles like progressive overload specificity and recovery cycles scientific approaches maximize results
how can i improve my performance in agility drills for tennis,to improve in agility drills for tennis focus on proper technique consistency and gradually increasing intensity
what are the common mistakes to avoid in hydration,common mistakes in hydration include neglecting warmups ignoring recovery and overloading without preparation proper planning is essential
what are some strategies for reducing screen time and promoting digital wellness in todays technologydriven world,set phonefree zones designate certain places such as the dinner table the living room or the bedroom where phones are not allowed  create a device agreement work with your children to set reasonable rules for device usage and have them agree to adhere to them  encourage outdoor activities play active outdoor games that dont involve screens and plan family outings without devices  place time limits set limits for daily and weekly device usage and establish a consistent bedtime to avoid latenight technology use
how does basketball jump training differ for beginners and advanced athletes,for beginners basketball jump training should be simplified with lower resistance advanced athletes can explore variations and added weight
can powerlifting tips help with injury prevention,yes powerlifting tips can prevent injuries by improving muscle imbalances and joint stability
what muscles are targeted by overcoming workout burnout,overcoming workout burnout primarily targets specific muscles making it excellent for specific fitness goals
which groups of people benefit most from balancing fitness with work life,balancing fitness with work life benefits beginners and advanced athletes looking to enhance performance in specific areas
how does proper endurance training technique prevent longterm injuries,proper endurance training technique minimizes stress on joints and muscles promoting longevity and reducing the likelihood of repetitive strain injuries
tell be about medicine ball scoop throw,the medicine ball scoop throw is an explosive exercise targeting the abdominals and hips it can be performed for lower reps with a focus on power or for higher reps with a focus on fat loss and conditioning it begins in a semisquat position holding a medicine ball which then gets scooped up and thrown overhead in one continuous movement
how do i properly perform face pulls,to perform face pulls correctly focus on maintaining proper form start slowly keep your movements controlled and engage the appropriate muscle groups
can you recommend healthy latenight snacks,choose snacks that wont disrupt sleep opt for a small serving of greek yogurt a handful of nuts or sliced veggies with hummus keep portions small and balanced to avoid overeating
tell be about kettlebell sumo deadlift high pull,the kettlebell sumo deadlift high pull is a dynamic kettlebell exercise that focuses on the muscles of the posterior chain including the hamstrings glutes traps rear delts and upper back it can be done in lower reps for power or strength or higher reps for conditioning and fat loss it can also be a component of a circuitstyle kettlebell workout either for time or reps
what role does proper breathing play in nutrition for muscle recovery,proper breathing during nutrition for muscle recovery ensures better oxygen flow maintains rhythm and reduces strain on muscles
what advanced tips do you have for bodyweightonly workouts,advanced tips for bodyweightonly workouts include incorporating progressive overload and experimenting with variations
tell be about bench skip,the bench skip is an explosive lowerbody exercise that involves alternating the position of the feet on top of a bench it primarily targets the muscles of the lower body but is also a serious cardiovascular challenge it is often performed for high reps or for time as part of a fatloss or athleticismfocused workout or circuit
why is it important to include pushups in a fitness routine,adding pushups to your workouts enhances specific muscle strength improves stability and contributes to balanced physical development
what are the benefits of staying consistent with recovery methods,consistency in recovery methods builds a strong foundation for enduring health benefits and maximizes results over time
can sprinting mechanics help with injury prevention,yes sprinting mechanics can prevent injuries by improving muscle imbalances and joint stability
what are the benefits of staying consistent with nutrition basics,consistency in nutrition basics builds a strong foundation for enduring health benefits and maximizes results over time
why is training programs important for maintaining overall wellness,training programs plays a critical role in preventing illnesses enhancing performance and supporting a balanced lifestyle
tell be about biceps curl to shoulder press,the biceps curl to shoulder press is a dumbbell complex that combines two exercises that build and strengthen the biceps and shoulders or deltoids it is usually performed one rep of each movement at a time although you could perform more reps of each or increase the reps in successive rounds eg  rep in round   reps in round  etc no matter how you structure the sets and reps it is a timeefficient way to hit two crucial upperbody muscles in any workout
tell be about singlearm kettlebell pushpress,the singlearm kettlebell pushpress is a popular kettlebell movement that involves performing a press with help from the muscles of the lower body it is preceded by a clean at the start of each set and optionally you can perform a clean between each rep it can be trained in traditional strength or musclebuilding rep ranges in circuit or fatloss training or as part of a larger kettlebell combination or complex
tell be about bodyweight reverse lunge,the reverse lunge is a lowerbody exercise targeting the quads glutes and hamstrings the reverse lunge places more emphasis on the glutes than other lunge variations
can foam rolling benefits help with injury prevention,yes foam rolling benefits can prevent injuries by improving muscle imbalances and joint stability
what are the steps to correctly perform face pulls,performing face pulls requires attention to detail start with a neutral posture engage your core and follow proper technique for each step
what are the benefits of doing ab rollouts,ab rollouts help improve strength flexibility and endurance they also target specific muscle groups and can enhance overall fitness
how can i improve my sleep quality if i have a hectic lifestyle,establish a bedtime routine avoid screens an hour before sleep and use relaxation techniques like deep breathing consistency is key even with a busy schedule
are there any risks associated with overdoing outdoor running,incorporating outdoor running into your routine enhances flexibility boosts mood and aids in achieving a wellrounded fitness level beginners can start gradually and increase intensity over time
can dynamic warmups improve my overall fitness if yes how,yes dynamic warmups enhances overall fitness by improving strength flexibility or cardiovascular health depending on execution
whats the importance of warming up before a workout and how can i do it effectively,effective warmup warm up with dynamic stretches and movements that mimic the workout gradually increase heart rate and blood flow warming up reduces injury risk and improves performance
tell be about cable overhead triceps extension,the cable overhead triceps extension is a cable exercise performed in a seated position targeting the triceps muscles while it hits all three heads of the triceps the overhead position helps to target the long head in particular the seated position helps eliminate the use of momentum it is usually performed for moderate to high reps as part of the armfocused portion of a workout
can stepups be adapted for home workouts,yes stepups can be adapted for home workouts using minimal equipment or body weight ensuring accessibility for all fitness levels
how can i improve my performance in dynamic warmups,to improve in dynamic warmups focus on proper technique consistency and gradually increasing intensity
tell be about standing suspended rear delt fly,the standing suspended rear delt fly is a bodyweight movement targeting the shoulders and upper back using a suspension strap system or gymnastic rings it can be performed for time or reps as part of a dynamic warmup for an upperbody strength workout or in the workout itself either in traditional musclebuilding rep ranges or for higher reps
how can i set realistic nutrition basicsrelated goals,setting realistic goals in nutrition basics ensures sustainable progress start small and build habits that support longterm success
can you explain the best practices for recovery methods,the best practices for recovery methods include consistency monitoring progress and seeking advice from professionals when needed
how can i optimize my performance in hydration tips for athletes,to optimize performance in hydration tips for athletes focus on technique consistency and gradually increasing resistance or intensity
what are the advanced techniques for workouts,incorporating workouts into your routine promotes cardiovascular health improves stamina and enhances muscle tone proper planning ensures maximum benefits
what muscles are targeted by intermittent fasting for fitness,intermittent fasting for fitness primarily targets specific muscles making it excellent for specific fitness goals
how can improper sled pushes form lead to injuries,incorrect form during sled pushes can strain muscles and joints increasing the risk of injuries proper alignment and technique are crucial
how can someone start with mental health and fitness,mental health and fitness is an excellent way to stay active and maintain a healthy lifestyle beginners should start slow and gradually increase intensity for the best results
how can improper deadlifts form lead to injuries,incorrect form during deadlifts can strain muscles and joints increasing the risk of injuries proper alignment and technique are crucial
why is functional fitness movements important for overall fitness,functional fitness movements is crucial for overall fitness because it addresses key areas like endurance strength or recovery
how can i optimize my performance in functional fitness movements,to optimize performance in functional fitness movements focus on technique consistency and gradually increasing resistance or intensity
what advanced tips do you have for plyometric training,advanced tips for plyometric training include incorporating progressive overload and experimenting with variations
how can strength training progression improve overall strength and stability,strength training progression enhances core stability improves posture and builds functional strength for daily activities
how do i properly perform spider crawls,to perform spider crawls correctly focus on maintaining proper form start slowly keep your movements controlled and engage the appropriate muscle groups
why is injury prevention for runners important for overall fitness,injury prevention for runners is crucial for overall fitness because it addresses key areas like endurance strength or recovery
how does stress impact fat storage and metabolism,chronic stress elevates cortisol levels which can lead to increased fat storage especially around the abdomen it also disrupts metabolism and appetite regulation
are there risks associated with postworkout protein intake,risks in postworkout protein intake include overuse injuries and improper form always listen to your body and seek guidance when needed
how do i properly perform high knees,to perform high knees correctly focus on maintaining proper form start slowly keep your movements controlled and engage the appropriate muscle groups
what are the top exercises for improving hydration and performance,engaging in hydration and performance helps build endurance improve cardiovascular health and strengthen specific muscle groups consistency is key to reaping its full benefits along with proper technique
which groups of people benefit most from swimming crosstraining benefits,swimming crosstraining benefits benefits beginners and advanced athletes looking to enhance performance in specific areas
are there specific recovery practices after an intense session of training for endurance,recovery after training for endurance can include stretching foam rolling and adequate hydration to reduce muscle soreness
tell be about sidetoside box skip,the sidetoside box skip is an explosive lowerbody exercise that involves jumping laterally over a bench or box landing with one foot on top of the surface and then switching positions it primarily targets the muscles of the lower body but is also a serious cardiovascular challenge it is often performed for high reps or for time as part of a fatloss or athleticismfocused workout or circuit
im struggling to stay consistent with healthy eating any advice,consistency can be challenging plan meals prep in advance and have healthy snacks on hand avoid extreme restrictions allow occasional treats and focus on progress rather than perfection
how often should i include cooldown strategies in my routine,include cooldown strategies in your routine 23 times per week ensuring adequate recovery time between sessions
how can sports performance be customized for people with different needs,customizing sports performance to your goals ensures it aligns with your physical capacity preferences and desired outcomes
what should beginners know about strength training,strength training is an excellent way to stay active and maintain a healthy lifestyle beginners should start slow and gradually increase intensity for the best results
what is the scientific basis behind effective sportsspecific conditioning,effective sportsspecific conditioning is underpinned by principles like progressive overload specificity and recovery cycles scientific approaches maximize results
can hydration tips for athletes improve my overall fitness if yes how,yes hydration tips for athletes enhances overall fitness by improving strength flexibility or cardiovascular health depending on execution
what are the benefits of doing wall sits,wall sits help improve strength flexibility and endurance they also target specific muscle groups and can enhance overall fitness
tell be about barbell rollout,the barbell rollout is an abdominal exercise that utilizes a barbell in the place of an ab roller it is best performed with a barbell that has rotating collars and is considered more difficult than other ab roller variations many lifters may not be able to perform a single rep at first but once they can perform these for reps theyll be rewarded with a seriously strong core
how does bodyweight exercises contribute to achieving fitness goals,incorporating bodyweight exercises into your routine enhances flexibility boosts mood and aids in achieving a wellrounded fitness level beginners can start gradually and increase intensity over time
tell be about bodyweight flyes,the doublebar rollout chest fly is a chest exercise that utilizes two rotating barbells as handles for a chest fly it targets the muscles of the chest but is also an intense core workout its a tough movement that is usually performed in the chestfocused portion of a workout
how can i optimize my nutrition to support my fitness goals,nutrition optimization tailor your diet to your goals focus on balanced macronutrients such as lean proteins complex carbs and healthy fats adjust calorie intake based on whether you aim to gain muscle or lose fat
what are common mistakes to avoid in exercise motivation,avoid overtraining or improper techniques while practicing exercise motivation staying consistent and focusing on form is key to avoiding injuries
can plyometric training help with injury prevention,yes plyometric training can prevent injuries by improving muscle imbalances and joint stability
how often should one focus on bodyweight exercises for optimal results,engaging in bodyweight exercises helps build endurance improve cardiovascular health and strengthen specific muscle groups consistency is key to reaping its full benefits along with proper technique
what are the advanced techniques for home fitness,incorporating home fitness into your routine promotes cardiovascular health improves stamina and enhances muscle tone proper planning ensures maximum benefits
tell be about zercher squat,the zercher squat is a barbell exercise in which the bar is placed in the crease of your elbows as you perform a normal squat this movement can be awkward at first but is extremely effective in building both size and strength
tell be about elbow plank,the elbow plank is a popular isometric abdominal exercise it is common in all types of exercise programs as well as in group fitness and yoga classes it targets the muscles of the core the deep core or transversus abdominis in particular it is also often prescribed for time to help back pain or to teach proper bracing
tell be about otisup,the otisup is a weighted exercise focusing on the abdominal muscles as well as the shoulders to a lesser degree it primarily targets the rectus abdominus or sixpack muscles but also involves the obliques and deep core muscles it is normally performed on a decline bench holding a weight plate but can also be performed with a dumbbell kettlebell or other weight
how does deadlift variations help prevent injuries,deadlift variations minimizes the risk of injury by strengthening supportive muscles and improving joint mobility
tell be about barbell full squat,the barbell back squat is a popular compound movement that emphasizes building the lowerbody muscle groups and overall strength its the classic way to start a leg day and is a worthy centerpiece to a lowerbody training program the squat is a competitive lift in the sport of powerlifting but is also a classic measurement of lowerbody strength with the barbell racked on the traps or upper back the emphasis is placed on the posterior chain but the entire body gets worked the back squat can be trained in everything from heavy singles to sets of  reps or higher
tell be about bear crawl sled drag,the bear crawl sled drag is an advanced variation of the bear crawl exercise involving added resistance from a sled or other weight if no sled is available other viable options include dragging chain a barbell plate or a tire the bear crawl sled drag is an intense fullbody movement that targets the cardiovascular system as well as a wide range of muscle groups particularly the shoulders core and legs it can be done in short bursts for power or circuit training or for longer durations as cardiovascular conditioning
what are the benefits of unstable surface training for fitness goals,unstable surface training offers several benefits including better strength flexibility and injury prevention
what are the benefits of doing spider crawls,spider crawls help improve strength flexibility and endurance they also target specific muscle groups and can enhance overall fitness
what are the benefits of staying consistent with hydration,consistency in hydration builds a strong foundation for enduring health benefits and maximizes results over time
what are the benefits of importance of sleep in recovery for fitness goals,importance of sleep in recovery offers several benefits including better strength flexibility and injury prevention
what variations of wall sits can i try for advanced training,advanced variations of wall sits include weighted versions singlearm or singleleg modifications or combining them with other movements for a fullbody challenge
how does injury prevention for runners differ for beginners and advanced athletes,for beginners injury prevention for runners should be simplified with lower resistance advanced athletes can explore variations and added weight
what are the best tools or technologies for enhancing hydration strategies,tools like wearable trackers apps and specialized equipment can enhance hydration strategies making it more measurable and efficient
what advanced tips do you have for hypertrophyspecific training,advanced tips for hypertrophyspecific training include incorporating progressive overload and experimenting with variations
what are common mistakes to avoid in pushup techniques,common mistakes in pushup techniques include poor form overloading and neglecting warmups focus on technique before increasing intensity
are there any common mistakes to avoid while doing skipping rope,common mistakes in skipping rope include improper alignment rushing through repetitions and failing to engage core muscles focus on technique to prevent injuries
how does functional fitness movements help prevent injuries,functional fitness movements minimizes the risk of injury by strengthening supportive muscles and improving joint mobility
what role does proper breathing play in resistance band exercises,proper breathing during resistance band exercises ensures better oxygen flow maintains rhythm and reduces strain on muscles
what should i focus on when starting basketball jump training,when starting basketball jump training prioritize learning the basics and seek guidance if needed
what are some common mistakes in overcoming workout burnout,common mistakes in overcoming workout burnout include neglecting alignment overloading weights and rushing through reps
how can i improve my performance in carbloading strategies,to improve in carbloading strategies focus on proper technique consistency and gradually increasing intensity
tell be about closegrip dumbbell bench press,the closegrip dumbbell bench press is a popular variation of the dumbbell bench press in which the dumbbells are held closer than shoulder width this places more emphasis on the triceps and perhaps also the inner chest the closegrip dumbbell bench press can be performed in lower reps for strength or higher reps for muscle growth
tell be about standing dumbbell shrug,the standing dumbbell shrug is a popular movement to build and strengthen the trapezius muscles its often trained on a bodybuildingstyle shoulder or back training day but can also work well in fullbody or strengthfocused training
how can i improve my performance in plyometric training,to improve in plyometric training focus on proper technique consistency and gradually increasing intensity
can you explain the progression strategies for mastering sportsspecific recovery,progression strategies for sportsspecific recovery include adding resistance increasing repetitions or trying advanced variations
what are common mistakes to avoid in strength training,avoid overtraining or improper techniques while practicing strength training staying consistent and focusing on form is key to avoiding injuries
what advanced tips do you have for agility drills for tennis,advanced tips for agility drills for tennis include incorporating progressive overload and experimenting with variations
are there specific recovery practices after an intense session of tracking fitness progress effectively,recovery after tracking fitness progress effectively can include stretching foam rolling and adequate hydration to reduce muscle soreness
what is the scientific basis behind effective endurance training,effective endurance training is underpinned by principles like progressive overload specificity and recovery cycles scientific approaches maximize results
can farmers walk be adapted for home workouts,yes farmers walk can be adapted for home workouts using minimal equipment or body weight ensuring accessibility for all fitness levels
