question,answer
what equipment is needed to practice calisthenics effectively,calisthenics not only improves physical fitness but also reduces stress and enhances mental clarity combining it with a balanced diet can amplify the results
how can i incorporate regular movement and exercise into my day even if i have a sedentary job,take frequent movement breaks during the day set an alarm to go off every  minutes and take a quick stretch break walk for five minutes around your office or outside or do some simple bodyweight exercises like wall sits or squats  schedule in a dedicated exercise block working out doesnt have to require a lot of timestart with a few minute bursts of activity throughout the day whether thats a hiit workout a yoga session or a brisk walk  walk during lunch use your lunch breaks to get some steps in by walking around
are there any common mistakes to avoid while doing calf raises,common mistakes in calf raises include improper alignment rushing through repetitions and failing to engage core muscles focus on technique to prevent injuries
are there professional guidelines for safe and effective highintensity interval training hiit,professional guidelines recommend starting with baseline assessments setting smart goals and integrating gradual progression for highintensity interval training hiit
can home fitness help with weight loss,engaging in home fitness helps improve physical strength endurance and mental wellbeing it also reduces the risk of chronic diseases and enhances overall fitness levels
what equipment is needed to practice bodyweight exercises effectively,bodyweight exercises not only improves physical fitness but also reduces stress and enhances mental clarity combining it with a balanced diet can amplify the results
which muscle groups are targeted during mobility drills,during mobility drills primary muscle groups like insert specific muscles are engaged providing a balanced workout
what muscles are targeted by mental focus during lifting,mental focus during lifting primarily targets specific muscles making it excellent for specific fitness goals
what is the scientific basis behind effective tracking fitness progress,effective tracking fitness progress is underpinned by principles like progressive overload specificity and recovery cycles scientific approaches maximize results
tell be about skip,the skip is an exercise that builds power and explosiveness in the legs its commonly performed by children and in gym classes but is also great for working the legs and hip flexors making it a favorite warmup for athletes who need to explode vertically
are there professional guidelines for safe and effective periodization strategies,professional guidelines recommend starting with baseline assessments setting smart goals and integrating gradual progression for periodization strategies
can cable rows be adapted for home workouts,yes cable rows can be adapted for home workouts using minimal equipment or body weight ensuring accessibility for all fitness levels
how can recovery protocols be optimized for elite performance,optimizing recovery protocols for elite performance involves careful attention to nutrition mental conditioning and biomechanical analysis
tell be about weighted bench dip,the weighted bench dip is a highly effective exercise for building the triceps the resistance comes from a combination of body weight and added weightusually a weight plate
how often should i include endurance programming in my routine,include endurance programming in your routine 23 times per week ensuring adequate recovery time between sessions
tell be about crossbody crunch,the elbowtoknee crunch is a bodyweight exercise targeting the ab muscles the obliques and rectus abdominis or sixpack muscles in particular it can be performed for time or reps as part of the abfocused portion of any workout
can you explain the progression strategies for mastering mental focus in training,progression strategies for mental focus in training include adding resistance increasing repetitions or trying advanced variations
how can i optimize my performance in powerlifting tips,to optimize performance in powerlifting tips focus on technique consistency and gradually increasing resistance or intensity
what are the steps to correctly perform stepups,performing stepups requires attention to detail start with a neutral posture engage your core and follow proper technique for each step
what are the benefits of doing face pulls,face pulls help improve strength flexibility and endurance they also target specific muscle groups and can enhance overall fitness
what are the benefits of exercise motivation,engaging in exercise motivation helps improve physical strength endurance and mental wellbeing it also reduces the risk of chronic diseases and enhances overall fitness levels
can you explain the progression strategies for mastering training for endurance,progression strategies for training for endurance include adding resistance increasing repetitions or trying advanced variations
how can beginners safely start with stretching routines,beginners should start with bodyweight or light resistance for stretching routines focusing on mastering form before intensity
why is importance of electrolytes important for overall fitness,importance of electrolytes is crucial for overall fitness because it addresses key areas like endurance strength or recovery
are there common mistakes in sprinting mechanics i should avoid,common mistakes in sprinting mechanics include rushing through movements and neglecting proper alignment
tell be about jumping rope,jumping rope is a classic conditioning exercise that is popular with everyone from children to boxers to crossfit athletes it targets many different muscles including the calves glutes shoulders and upper back and is great for everything from fat loss to improving overall athletic performance
what advanced tips do you have for periodization techniques,advanced tips for periodization techniques include incorporating progressive overload and experimenting with variations
what are the benefits of doing skipping rope,skipping rope help improve strength flexibility and endurance they also target specific muscle groups and can enhance overall fitness
how can training programs be customized for people with different needs,customizing training programs to your goals ensures it aligns with your physical capacity preferences and desired outcomes
what role does proper breathing play in barbell techniques,proper breathing during barbell techniques ensures better oxygen flow maintains rhythm and reduces strain on muscles
what advanced tips do you have for setting realistic fitness goals,advanced tips for setting realistic fitness goals include incorporating progressive overload and experimenting with variations
tell be about arm circle,the arm circle is a nonweighted exercise targeting the shoulders it involves extending your arms to the sides and drawing small circles in the air with your hands it is common in warmups for both training and athletics and is often performed simply until someone feels a burn rather than for a set amount of reps
what is the best way to progress with turkish getups,to progress in turkish getups gradually increase intensity by adding weight repetitions or resistance tracking performance helps sustain improvements
tell be about standing dumbbell shoulder press,the standing dumbbell shoulder press is a classic deltoidbuilding exercise that is common in gyms around the world performing the move standing up as opposed to seated allows more weight to be used and taxes the core more than seated presses the standing press is worthy of being the main movement in a musclebuilding shoulder workout but is also a great strength movement and accessory for the bench press
tell be about barbell ab rollout  on knees,the barbell rollout is an abdominal exercise that utilizes a barbell in the place of an ab roller it is best performed with a barbell that has rotating collars and is considered more difficult than other ab roller variations many lifters may not be able to perform a single rep at first but once they can perform these for reps theyll be rewarded with a seriously strong core
how can i improve my performance in barbell deadlift technique,to improve in barbell deadlift technique focus on proper technique consistency and gradually increasing intensity
tell be about lying hamstring stretch with band,the lying hamstring stretch with band is a simple way to stretch a chronically tight muscle group of the lower body it is common in stretching and yoga classes but can also be performed individually as part of a warmup paired with movements in a workout or as part of a cooldown or recovery strategy
what advanced tips do you have for hydration tips for athletes,advanced tips for hydration tips for athletes include incorporating progressive overload and experimenting with variations
how does core strength exercises contribute to achieving fitness goals,incorporating core strength exercises into your routine enhances flexibility boosts mood and aids in achieving a wellrounded fitness level beginners can start gradually and increase intensity over time
what are the benefits of doing cable rows,cable rows help improve strength flexibility and endurance they also target specific muscle groups and can enhance overall fitness
what are some beginner tips for improving injury prevention,improving injury prevention involves consistent effort learning proper techniques and tailoring routines to your individual needs
is soccer endurance drills better suited for strength or endurance goals,soccer endurance drills can be tailored for both strength and endurance adjust the load and repetitions accordingly
what are some practical tips for maintaining healthy hair and skin,drink plenty of water hydration is essential for keeping your skin and hair healthy so aim for  glasses of water every day  get regular haircuts trimming your hair every  weeks will help keep it healthy and prevent split ends  use sunscreen applying sunscreen before you head out into the sun will help protect your skin from damage  eat a balanced diet eating plenty of fruits and veggies will help provide your body with essential vitamins and minerals that will keep your skin and hair looking healthy  exfol
how does recovery time vary depending on the intensity of functional fitness,the intensity of functional fitness dictates recovery needs higher intensities require more time for muscle repair and glycogen replenishment
are there common mistakes in unstable surface training i should avoid,common mistakes in unstable surface training include rushing through movements and neglecting proper alignment
tell be about dumbbell side bend,the dumbbell side bend is a popular exercise for targeting the oblique muscles of the abdomen it is usually performed for relatively high reps at least  reps per set or more it can be performed one side at a time or alternating sides
what are common mistakes to avoid in deadlift variations,common mistakes in deadlift variations include poor form overloading and neglecting warmups focus on technique before increasing intensity
how often should someone practice home fitness,avoid overtraining or improper techniques while practicing home fitness staying consistent and focusing on form is key to avoiding injuries
what muscles are targeted by swimming crosstraining benefits,swimming crosstraining benefits primarily targets specific muscles making it excellent for specific fitness goals
tell be about chest dip,the chest dip is a bodyweight exercise performed on parallel bars or on a pullup and dip station it targets the chest triceps and shoulders dips with a chest focus are usually performed with the torso leaning forward and the elbows angled out from the torso dips can be performed for low reps for strength or higher reps for muscle growth
what are the advanced techniques for running,incorporating running into your routine promotes cardiovascular health improves stamina and enhances muscle tone proper planning ensures maximum benefits
what is the scientific basis behind effective nutrition for athletes,effective nutrition for athletes is underpinned by principles like progressive overload specificity and recovery cycles scientific approaches maximize results
what is the correct form for periodization techniques,the correct form for periodization techniques includes maintaining a neutral spine engaging your core and controlled movement
what are the benefits of doing pushups,pushups help improve strength flexibility and endurance they also target specific muscle groups and can enhance overall fitness
how can someone start with exercise motivation,exercise motivation is an excellent way to stay active and maintain a healthy lifestyle beginners should start slow and gradually increase intensity for the best results
what are the benefits of preworkout meals for fitness goals,preworkout meals offers several benefits including better strength flexibility and injury prevention
tell be about cable straightbar upright row,the cable straightbar upright row is an isolation exercise for the traps and the medial deltoids it may not be appropriate for all lifters depending on their shoulder health and injury history it is usually performed for moderate to high reps such as  reps per set or more as part of an upperbody or shoulderfocused workout
what are some common mistakes in fitness motivation strategies,common mistakes in fitness motivation strategies include neglecting alignment overloading weights and rushing through reps
which muscle groups are targeted during barbell techniques,during barbell techniques primary muscle groups like insert specific muscles are engaged providing a balanced workout
is sprinting mechanics better suited for strength or endurance goals,sprinting mechanics can be tailored for both strength and endurance adjust the load and repetitions accordingly
how often should someone practice weight management,avoid overtraining or improper techniques while practicing weight management staying consistent and focusing on form is key to avoiding injuries
tell be about straightarm plank with kickback,the straightarm plank with kickback is a hybrid movement that trains the abdominal and triceps muscles simultaneously it can address multiple muscle groups in a timeefficient musclebuilding or circuitstyle workout while also providing an additional cardiovascular challenge
can importance of sleep in recovery improve my overall fitness if yes how,yes importance of sleep in recovery enhances overall fitness by improving strength flexibility or cardiovascular health depending on execution
are there specific recovery practices after an intense session of mental focus in training,recovery after mental focus in training can include stretching foam rolling and adequate hydration to reduce muscle soreness
tell be about cable crossover,the cable crossover is an isolation movement that uses a cable stack to build bigger and stronger pectoral muscles since its done using adjustable pulleys you can target different parts of your chest by setting the pulleys at different levels it is common in upper body and chestfocused musclebuilding workouts often as a preexhaust at the beginning of a workout or a finishing movement at the end it is often in combination with other presses or flyes to target the chest from different angles
tell be about standing hip extension,the standing hip extension is a movement that activates the glutes and hamstrings it is often performed either for time or reps as part of a dynamic warmup
tell be about overhead bar front raise,the overhead bar front raise is an exercise targeting the muscles of the traps trapezius especially the upper traps as well as the front or anterior shoulders it can also be performed with a weight plate or dumbbell providing a neutral grip that may be more shoulderfriendly for some lifters overhead raises are most common for high reps at least  reps per set or higher on a shoulder trap or other upperbodyfocused musclebuilding day
how does rest day optimization help prevent injuries,rest day optimization minimizes the risk of injury by strengthening supportive muscles and improving joint mobility
what are the benefits of datadriven fitness tracking for fitness goals,datadriven fitness tracking offers several benefits including better strength flexibility and injury prevention
what are the steps to correctly perform cable rows,performing cable rows requires attention to detail start with a neutral posture engage your core and follow proper technique for each step
how can i modify squats for beginners,beginners can modify squats by reducing the range of motion using assistance like resistance bands or performing it at a slower pace to build strength gradually
are there risks associated with mental focus during lifting,risks in mental focus during lifting include overuse injuries and improper form always listen to your body and seek guidance when needed
why is endurance programming important for overall fitness,endurance programming is crucial for overall fitness because it addresses key areas like endurance strength or recovery
tell be about smith machine incline bench press,the smith machine incline bench press is a machinebased movement targeting the chest particularly the upper chest the smith machine mimics a barbell but provides more stability this movement can be programmed in low reps for strength or higher reps for muscle and strength endurance it is often performed for moderate to high reps such as  reps per set or more as part of a chest or upperbody focused workout
tell be about feetelevated pushup,the feetelevated pushup is a variation on the pushup a bodyweight standard the feet are elevated so that your body is aligned at an angle to the floor rather than parallel this makes it more difficult than pushups on the floor but also puts more emphasis on the shoulder muscles it is often used as a bodyweight substitute for incline presses or as a burnout movement for a chest or shoulder workout
how can individuals with the stress type reduce cortisol levels and manage fat,strategies include stress reduction techniques like meditation eliminating inflammatory foods increasing omega intake and engaging in highintensity interval training hiit
tell be about smith machine decline press,the smith machine decline bench press is a machinebased exercise targeting the chest muscles particularly the lower pectoral muscles the smith machine mimics a barbell but provides more stability this movement is often performed for moderate to high reps such as  reps per set or more as part of a chest or upperbody workout
tell be about lying cable triceps extension,the lying cable triceps extension is an isolation exercise performed lying on either a bench or the floor this movement is usually performed for moderate to high reps for a burn and pump as part of an armfocused workout
can fitness motivation strategies help with injury prevention,yes fitness motivation strategies can prevent injuries by improving muscle imbalances and joint stability
what role does nutrition play in nutrition,to excel in nutrition invest in basic equipment like weights mats or appropriate footwear these tools enhance safety and effectiveness
how can i improve my performance in intermittent fasting for fitness,to improve in intermittent fasting for fitness focus on proper technique consistency and gradually increasing intensity
how can improper stepups form lead to injuries,incorrect form during stepups can strain muscles and joints increasing the risk of injuries proper alignment and technique are crucial
which groups of people benefit most from cooldown strategies,cooldown strategies benefits beginners and advanced athletes looking to enhance performance in specific areas
what role does proper breathing play in sportsspecific recovery,proper breathing during sportsspecific recovery ensures better oxygen flow maintains rhythm and reduces strain on muscles
how does injury prevention for shoulders differ for beginners and advanced athletes,for beginners injury prevention for shoulders should be simplified with lower resistance advanced athletes can explore variations and added weight
are there risks associated with advanced hiit protocols,risks in advanced hiit protocols include overuse injuries and improper form always listen to your body and seek guidance when needed
what should i focus on when starting core strengthening exercises,when starting core strengthening exercises prioritize learning the basics and seek guidance if needed
tell be about reversegrip handselevated pushup,the reversegrip handselevated pushup is a bodyweight exercise performed on a smith machine or other elevated surface it targets the chest triceps and shoulders it can work as a regression of floor reversegrip pushups or in a progressive mechanical dropset moving the bar up once you reach failure at a lower height
which muscle groups are targeted during strength training progression,during strength training progression primary muscle groups like insert specific muscles are engaged providing a balanced workout
how often should someone practice nutrition,avoid overtraining or improper techniques while practicing nutrition staying consistent and focusing on form is key to avoiding injuries
what variations of sled pushes can i try for advanced training,advanced variations of sled pushes include weighted versions singlearm or singleleg modifications or combining them with other movements for a fullbody challenge
how does age affect functional fitness and what adaptations are needed,as we age functional fitness should adapt by reducing intensity increasing recovery periods and emphasizing mobility to maintain performance and safety
what advanced tips do you have for sprinting mechanics,advanced tips for sprinting mechanics include incorporating progressive overload and experimenting with variations
how can i improve my performance in balancing fitness with work life,to improve in balancing fitness with work life focus on proper technique consistency and gradually increasing intensity
how can i modify planks for beginners,beginners can modify planks by reducing the range of motion using assistance like resistance bands or performing it at a slower pace to build strength gradually
can you provide guidance on finding the right fitness program or workout routine for my goals,customizing workouts define your goals whether its strength endurance fat loss or a combination research and choose a program aligned with your preferences and time commitment gradually progress as you improve
what role does nutrition play in physical activities,to excel in physical activities invest in basic equipment like weights mats or appropriate footwear these tools enhance safety and effectiveness
how does recovery time vary depending on the intensity of hydration strategies,the intensity of hydration strategies dictates recovery needs higher intensities require more time for muscle repair and glycogen replenishment
what are the top exercises for improving calisthenics,engaging in calisthenics helps build endurance improve cardiovascular health and strengthen specific muscle groups consistency is key to reaping its full benefits along with proper technique
can you explain the progression strategies for mastering rest day optimization,progression strategies for rest day optimization include adding resistance increasing repetitions or trying advanced variations
tell be about bodyweight squat,the bodyweight squat is a fundamental exercise that strengthens the quads glutes and hamstrings it can be performed as part of a dynamic warmup for time or reps during a workout or for hip and spine mobility any time
what should i focus on when starting datadriven fitness tracking,when starting datadriven fitness tracking prioritize learning the basics and seek guidance if needed
tell be about standing side bend stretch,the standing side bend stretch is a stretching exercise targeting the obliques the muscles that run along the side of the core it is a common inclusion in dynamic warmups for the upper body but can also be performed to help limber up for lifting or athletics anytime
what variations of spider crawls can i try for advanced training,advanced variations of spider crawls include weighted versions singlearm or singleleg modifications or combining them with other movements for a fullbody challenge
tell be about singlearm cable crossover,the singlearm cable crossover is an isolation movement that uses a cable stack to build bigger and stronger pectoral muscles working the chest one side at a time allows you to focus on the balance between the sides of your chest and really feel the chest muscles contracting it is common in upperbody and chestfocused musclebuilding workouts often in combination with other presses or flyes to target the chest from different angles
what should i focus on when starting stress impact on fitness progress,when starting stress impact on fitness progress prioritize learning the basics and seek guidance if needed
how do i integrate preworkout meals into my workout routine,integrating preworkout meals into your routine requires strategic planning to avoid overtraining
what variations of hollow body holds can i try for advanced training,advanced variations of hollow body holds include weighted versions singlearm or singleleg modifications or combining them with other movements for a fullbody challenge
how can i modify medicine ball slams for beginners,beginners can modify medicine ball slams by reducing the range of motion using assistance like resistance bands or performing it at a slower pace to build strength gradually
