question,answer
what muscles are targeted by progressive overload,progressive overload primarily targets specific muscles making it excellent for specific fitness goals
tell be about lying cable biceps curl,the lying cable biceps curl is a cable exercise that targets the biceps it is performed lying on the back either on a bench or the ground with the feet facing toward a cable stack this movement is usually performed for moderate to high reps for a burn and pump as part of an armfocused workout
what should i focus on when starting pushup modifications,when starting pushup modifications prioritize learning the basics and seek guidance if needed
how can hydration strategies be optimized for elite performance,optimizing hydration strategies for elite performance involves careful attention to nutrition mental conditioning and biomechanical analysis
what are the best techniques for performing functional fitness movements,the best techniques for functional fitness movements involve maintaining proper alignment controlled movement and engaging the targeted muscles effectively
tell be about treadmill jogging,treadmill jogging is a popular cardiovascular exercise performed on a machine that is available in most gyms performing this exercise on a treadmill allows you to adjust the speed of your jogging and depending on the machine perform it on an adjustable incline many machines also have builtin heart rate monitors and timers to help you track your progress
tell be about standing onearm cable curl,the singlearm cable biceps curl is a singlejoint isolation exercise for building the biceps this move is intended to be strict and deliberate this is not an exercise for using momentum or otherwise cheating
why is tracking metrics crucial in mastering injury rehabilitation,tracking metrics like heart rate time under tension or vo2 max provides datadriven insights for refining injury rehabilitation techniques and outcomes
what is the science behind the benefits of core strength exercises,to maximize benefits from core strength exercises focus on maintaining proper posture staying hydrated and warming up beforehand this minimizes risks and ensures longterm progress
what are the common mistakes to avoid in general health,common mistakes in general health include neglecting warmups ignoring recovery and overloading without preparation proper planning is essential
tell be about weighted situps  with bands,the weighted situp is a more difficult version of a highly popular abdominal movement the simple addition of a weight makes the situp far more difficult providing a different stimulus to the core during training and helping build strong abs
how can i optimize my performance in cooldown strategies,to optimize performance in cooldown strategies focus on technique consistency and gradually increasing resistance or intensity
which muscle groups are targeted during hiit training tips,during hiit training tips primary muscle groups like insert specific muscles are engaged providing a balanced workout
which muscle groups are targeted during balance improvement techniques,during balance improvement techniques primary muscle groups like insert specific muscles are engaged providing a balanced workout
how do i properly perform dumbbell flyes,to perform dumbbell flyes correctly focus on maintaining proper form start slowly keep your movements controlled and engage the appropriate muscle groups
how can i promote a healthy work environment and manage workrelated stress,offer flexible working hours and opportunities for remote working  encourage employees to take regular breaks during the day  promote healthy eating and create healthy snack options  provide taskbased breaks such as yoga stretching or meditation  create opportunities for collaboration and teambuilding activities  allow time off for exercise and relaxation  ensure employees have a clear understanding of their workload and responsibilities  empower employees to provide feedback on their workload and working conditions  provide ways for employees
how often should someone practice hydration,avoid overtraining or improper techniques while practicing hydration staying consistent and focusing on form is key to avoiding injuries
how does proper strength training technique prevent longterm injuries,proper strength training technique minimizes stress on joints and muscles promoting longevity and reducing the likelihood of repetitive strain injuries
can cooldown strategies help with injury prevention,yes cooldown strategies can prevent injuries by improving muscle imbalances and joint stability
what is the best way to progress with cable rows,to progress in cable rows gradually increase intensity by adding weight repetitions or resistance tracking performance helps sustain improvements
can setting realistic fitness goals help with injury prevention,yes setting realistic fitness goals can prevent injuries by improving muscle imbalances and joint stability
tell be about back extension,the back extension is an exercise used to build lower back strength that also targets the hamstrings and glutes it is often performed on a degree bench with the feet anchored unweighted back extensions are often performed for high reps such as  reps or more but the movement can also be performed with added weight in lower rep ranges such as  reps per set
is muscle soreness management better suited for strength or endurance goals,muscle soreness management can be tailored for both strength and endurance adjust the load and repetitions accordingly
why is it important to include planks in a fitness routine,adding planks to your workouts enhances specific muscle strength improves stability and contributes to balanced physical development
can sled pushes be adapted for home workouts,yes sled pushes can be adapted for home workouts using minimal equipment or body weight ensuring accessibility for all fitness levels
how can i modify rowing for beginners,beginners can modify rowing by reducing the range of motion using assistance like resistance bands or performing it at a slower pace to build strength gradually
tell be about exercise ball torso rotation,the exercise ball torso rotation is a rotational abdominal exercise performed while holding a yoga or exercise ball between the hands it focuses on the rotational muscles of the core including the obliques glutes and hip muscles it can be performed one side at a time or alternating either for time or reps to make it more difficult wrap a light exercise band around the ball and anchor it to a solid object
how does pushup modifications differ from other similar techniques,pushup modifications is unique due to its focus on specific feature making it ideal for certain fitness goals
what role does proper breathing play in squat variations,proper breathing during squat variations ensures better oxygen flow maintains rhythm and reduces strain on muscles
which groups of people benefit most from machine exercises,machine exercises benefits beginners and advanced athletes looking to enhance performance in specific areas
are there specific recovery practices after an intense session of sportsspecific recovery,recovery after sportsspecific recovery can include stretching foam rolling and adequate hydration to reduce muscle soreness
what role does proper breathing play in core strengthening exercises,proper breathing during core strengthening exercises ensures better oxygen flow maintains rhythm and reduces strain on muscles
how does preworkout meals differ for beginners and advanced athletes,for beginners preworkout meals should be simplified with lower resistance advanced athletes can explore variations and added weight
how can i set realistic training programsrelated goals,setting realistic goals in training programs ensures sustainable progress start small and build habits that support longterm success
how do i properly perform bicycle crunches,to perform bicycle crunches correctly focus on maintaining proper form start slowly keep your movements controlled and engage the appropriate muscle groups
what should i focus on when starting powerlifting tips,when starting powerlifting tips prioritize learning the basics and seek guidance if needed
tell be about smith machine bentover row,the smith machine bentover row is an upperbody exercise targeting the muscles of the back particularly the lats latissimus dorsi this movement can be programmed in low reps for strength or higher reps for muscle and strength endurance it is often performed for moderate to high reps such as  reps per set or more as part of an upperbody or backfocused workout
can weight management help with weight loss,engaging in weight management helps improve physical strength endurance and mental wellbeing it also reduces the risk of chronic diseases and enhances overall fitness levels
tell be about handstand pushup,the handstand pushup is an exercise targeting the shoulders although other muscles assist in the completion of the reps it is common in both crossfit workouts and advanced bodyweight or calisthenics training given the degree of difficulty beginners will need to progress to this move
what are the best tools or technologies for enhancing injury rehabilitation,tools like wearable trackers apps and specialized equipment can enhance injury rehabilitation making it more measurable and efficient
can intermittent fasting for fitness improve my overall fitness if yes how,yes intermittent fasting for fitness enhances overall fitness by improving strength flexibility or cardiovascular health depending on execution
are there any common mistakes to avoid while doing bicep curls,common mistakes in bicep curls include improper alignment rushing through repetitions and failing to engage core muscles focus on technique to prevent injuries
can beginners include strength training for beginners in their routine and how,strength training for beginners not only improves physical fitness but also reduces stress and enhances mental clarity combining it with a balanced diet can amplify the results
are there any common mistakes to avoid while doing cable rows,common mistakes in cable rows include improper alignment rushing through repetitions and failing to engage core muscles focus on technique to prevent injuries
what is the correct form for swimming crosstraining benefits,the correct form for swimming crosstraining benefits includes maintaining a neutral spine engaging your core and controlled movement
tell be about flat bench lying leg raise,the lying leg lift is a popular bodyweight exercise targeting the muscles of the abs the rectus abdominis or sixpack muscles in particular it can be performed for time or reps in the corefocused portion of any workout
what are the benefits of doing dumbbell flyes,dumbbell flyes help improve strength flexibility and endurance they also target specific muscle groups and can enhance overall fitness
tell be about overhead dumbbell front raise,the overhead dumbbell front raise takes the dumbbell front raise one step further extending the motion all the way above the head in addition to the shoulders it activates and strengthens the muscles of the traps and upper back it is usually performed for moderate to high reps such as  reps or more it can be part of a dynamic upperbody warmup performed as a musclebuilding upperbody movement or as a burnout movement on shoulder day
tell be about clock pushup,the clock pushup is a series of regular pushups performed one at a time moving your hands one step to the side between each one until youve completed a full circle it targets the same muscles as traditional pushups such as the chest triceps and shoulders but adds an endurance and core challenge to traditional pushups
tell be about seated dumbbell biceps curl,the seated dumbbell biceps curl is a popular exercise for building bigger biceps while curls can effectively be performed standing as well performing them seated can enforce strict form and perhaps boost the mindmuscle connection like most curl variations these are usually performed for moderate to high reps such as  reps per set or more
are there common mistakes in periodization techniques i should avoid,common mistakes in periodization techniques include rushing through movements and neglecting proper alignment
how can someone start with weight management,weight management is an excellent way to stay active and maintain a healthy lifestyle beginners should start slow and gradually increase intensity for the best results
how does carbloading strategies differ from other similar techniques,carbloading strategies is unique due to its focus on specific feature making it ideal for certain fitness goals
are there common mistakes in carbloading strategies i should avoid,common mistakes in carbloading strategies include rushing through movements and neglecting proper alignment
how do i properly perform leg raises,to perform leg raises correctly focus on maintaining proper form start slowly keep your movements controlled and engage the appropriate muscle groups
tell be about box jump,the box jump is an explosive exercise that strengthens the muscles of the lower body including the quads glutes calves and hamstrings they also develop power in the lower body while revving the heart rate box jumps can be performed for low reps to focus on strength and power or for higher reps for metabolic conditioning most coaches recommend stepping down rather than jumping down between reps
what role does proper breathing play in plyometric drills,proper breathing during plyometric drills ensures better oxygen flow maintains rhythm and reduces strain on muscles
tell be about neutralgrip pullup,the neutralgrip pullup is a multijoint bodyweight exercise in which the reps are performed with the palms facing one another like other pullup variations it builds strength and muscle in the upper back biceps and core it can be used as a more shoulderfriendly alternative to straightbar pullups or to help perform more reps than you can perform overhand
can you provide a breakdown of progressive methods in cardio endurance,progressive methods in cardio endurance ensure steady gains involving stepwise increases in load or complexity to challenge the body appropriately
how do i integrate hydration tips for athletes into my workout routine,integrating hydration tips for athletes into your routine requires strategic planning to avoid overtraining
tell be about suspended row,the suspended row is a bodyweight pulling exercise that focuses on the muscles of the middle and upper back as well as the biceps it can be trained in traditional musclebuilding rep ranges or for higher reps it can also work as part of a dynamic warmup for a pressing or pullingfocused workout
what is the correct form for sprinting mechanics,the correct form for sprinting mechanics includes maintaining a neutral spine engaging your core and controlled movement
how can calisthenics be modified for people with busy schedules,to maximize benefits from calisthenics focus on maintaining proper posture staying hydrated and warming up beforehand this minimizes risks and ensures longterm progress
can plyometric training improve my overall fitness if yes how,yes plyometric training enhances overall fitness by improving strength flexibility or cardiovascular health depending on execution
how can improper skipping rope form lead to injuries,incorrect form during skipping rope can strain muscles and joints increasing the risk of injuries proper alignment and technique are crucial
how often should i include intermittent fasting for fitness in my routine,include intermittent fasting for fitness in your routine 23 times per week ensuring adequate recovery time between sessions
what are some effective strategies for staying hydrated during workouts,hydration during exercise drink water before during and after workouts monitor urine color for hydration status include electrolytes for longer sessions dehydration impairs performance and recovery
how does bodyweightonly workouts differ from other similar techniques,bodyweightonly workouts is unique due to its focus on specific feature making it ideal for certain fitness goals
tell be about dumbbell lying rear lateral raise,the incline dumbbell reverse fly is an upperbody exercise targeting the posterior or rear deltoids as well as the postural muscles of the upper back because it targets such small muscles this exercise is usually performed with light weight for high reps such as  reps per set or more
what are the best tools or technologies for enhancing highintensity interval training hiit,tools like wearable trackers apps and specialized equipment can enhance highintensity interval training hiit making it more measurable and efficient
what role does nutrition play in sports training,to excel in sports training invest in basic equipment like weights mats or appropriate footwear these tools enhance safety and effectiveness
what are some common mistakes in injury prevention for shoulders,common mistakes in injury prevention for shoulders include neglecting alignment overloading weights and rushing through reps
are there risks associated with importance of electrolytes,risks in importance of electrolytes include overuse injuries and improper form always listen to your body and seek guidance when needed
tell be about brachialis smr,brachialis selfmyofascial release smr is a selfadministered softtissue treatment for the upper body usually using a foam roller lacrosse ball or other trigger point massage tool by applying pressure strategically to the biceps or brachialis muscles of the upper arm some people find they can cause this often painful and tight muscle to relax or release brachialis smr is often accompanied by smr on the triceps muscles or pectorals or by stretches that target the biceps or pecs
tell be about preacher curl,the ezbar preacher curl is a classic exercise for building bigger biceps this move is all about isolation with the back of the upper arms against the pad its next to impossible to cheat go light get a great pump and build that peak
how do i integrate muscle soreness management into my workout routine,integrating muscle soreness management into your routine requires strategic planning to avoid overtraining
tell be about one handed hang,the singlearm hang is a static exercise that involves hanging from a bar by one hand it is an advanced hanging exercise that demands aboveaverage shoulder stability and grip strength and may not be appropriate for some people however if someone is strong and stable enough to perform it the movement can help build those same qualities
how can i reduce my reliance on processed foods and incorporate more whole nutrientdense foods into my diet,try to shop around the perimeter of the grocery store which is usually where you will find the freshest items  if youre used to eating a lot of processed convenience foods take some time to learn how to prepare whole ingredients that you can then have onhand to make quick meals  make a weekly meal plan this allows you to plan ahead and shop for the ingredients needed for meals youre likely to enjoy  get creative in the kitchen and look for recipes that are colorful and include as many fresh unprocessed ingredients as
how can i foster healthy and positive relationships with food focusing on nourishment rather than restriction or guilt,practice selfcompassion remind yourself that food is nourishment not punishment or reward  focus on eating to meet your physical needs not emotional ones  adopt a mindful eating approach where you focus on the process of eating as well as the taste  aim to eat a variety of nutritious foods including fruits vegetables grains proteins nuts and healthy fats  dont forbid certain foods but instead focus on balance  respect hunger and fullness cues
what are the best tools or technologies for enhancing periodization strategies,tools like wearable trackers apps and specialized equipment can enhance periodization strategies making it more measurable and efficient
which groups of people benefit most from importance of sleep in recovery,importance of sleep in recovery benefits beginners and advanced athletes looking to enhance performance in specific areas
what are advanced strategies for improving sportsspecific conditioning,advanced strategies for sportsspecific conditioning include periodized training incorporating feedback loops and using specific drills tailored to your sport or goals
tell be about band pull apart,the band pullapart is an exercise targeting the upper back muscles including the trapezius rear delts and rhomboids the band creates dynamic tension allowing you to really focus on contracting these muscles making it a great activation drill prior to upperbody lifting
what are some beginner tips for improving sports performance,improving sports performance involves consistent effort learning proper techniques and tailoring routines to your individual needs
what are the common mistakes to avoid in common fitness myths,common mistakes in common fitness myths include neglecting warmups ignoring recovery and overloading without preparation proper planning is essential
what equipment is needed for home fitness,to excel in home fitness invest in basic equipment like weights mats or appropriate footwear these tools enhance safety and effectiveness
how does sports performance contribute to better physical and mental health,prioritizing sports performance improves focus boosts mood and supports resilience against stress making it an essential aspect of wellbeing
how does technique improvement contribute to better physical and mental health,prioritizing technique improvement improves focus boosts mood and supports resilience against stress making it an essential aspect of wellbeing
are there specific recovery practices after an intense session of cooldown stretches,recovery after cooldown stretches can include stretching foam rolling and adequate hydration to reduce muscle soreness
why is it important to include lunges in a fitness routine,adding lunges to your workouts enhances specific muscle strength improves stability and contributes to balanced physical development
how should i warm up before performing setting realistic fitness goals,a warmup before setting realistic fitness goals should include dynamic stretches and lighter sets to prepare the muscles involved
are there risks associated with squat variations,risks in squat variations include overuse injuries and improper form always listen to your body and seek guidance when needed
can cooldown strategies improve my overall fitness if yes how,yes cooldown strategies enhances overall fitness by improving strength flexibility or cardiovascular health depending on execution
how does progressive overload differ for beginners and advanced athletes,for beginners progressive overload should be simplified with lower resistance advanced athletes can explore variations and added weight
can overcoming workout burnout help with injury prevention,yes overcoming workout burnout can prevent injuries by improving muscle imbalances and joint stability
tell be about dumbbell suitcase crunch,the dumbbell suitcase crunch is a weighted version of a popular abdominal training exercise the simple addition of a weight makes the suitcase crunch far more difficult helping build the six pack muscles and providing a different stimulus to the core during training
how does tracking fitness progress effectively help prevent injuries,tracking fitness progress effectively minimizes the risk of injury by strengthening supportive muscles and improving joint mobility
what are the best ways to prevent burnout when balancing work and family,set clear boundaries delegate tasks and prioritize your wellbeing make time for hobbies and relaxation to recharge
how do i properly perform mountain climbers,to perform mountain climbers correctly focus on maintaining proper form start slowly keep your movements controlled and engage the appropriate muscle groups
what should i focus on when starting postworkout protein intake,when starting postworkout protein intake prioritize learning the basics and seek guidance if needed
can barbell deadlift technique help with injury prevention,yes barbell deadlift technique can prevent injuries by improving muscle imbalances and joint stability
how can sports performance training be modified for people with busy schedules,to maximize benefits from sports performance training focus on maintaining proper posture staying hydrated and warming up beforehand this minimizes risks and ensures longterm progress
what advanced tips do you have for squat variations,advanced tips for squat variations include incorporating progressive overload and experimenting with variations
how does strength training impact overall health,incorporating strength training into your routine promotes cardiovascular health improves stamina and enhances muscle tone proper planning ensures maximum benefits
tell be about feetelevated crunch,the feetelevated crunch is a variation on the basic crunch a very popular ab move resting the feet on a bench takes some of the hip flexor activation out of the movement focusing the stress more on the abs it may have a small range of motion but this movement produces a major burn
tell be about barbell shrug,the barbell shrug is an exercise targeting the traps trapezius muscles it is popular in strength and musclefocused upperbody training and is often trained on a shoulder day with the assistance of straps it can be loaded heavily but it is still usually performed for moderate to high reps such as  reps per set
can you provide a breakdown of progressive methods in warmup routines,progressive methods in warmup routines ensure steady gains involving stepwise increases in load or complexity to challenge the body appropriately
